Id,ForumTopicId,AuthorUserId,PostDate,Message,ReplyToForumMessageId,TopicMessagePosition,RawMarkdown,Score,FlaggedCount
62,21,703,"2010-05-24 15:21:18","I am dismayed by Will's response.<br rel=""nofollow"" ><br>This is no longer ""no knowledge of biology is necessary to succeed in 
this competition"", the results will be dominated by companies and 
experts which have gleaned information from patients outside of the 
dataset.<br><br>For example, in the database cited:<br><br>63568 RT Sequences, 63842 Protease Sequences<br><br>This database has many patients outside of the contest dataset, and experts have been poring over it making their conclusions publicly available.<br><br>(As for example <a href=""http://wanglab.ucsd.edu/html/publications/HIV_drug_resistance_PNAS.pdf"" mce_href=""http://wanglab.ucsd.edu/html/publications/HIV_drug_resistance_PNAS.pdf"">here</a>.)<br><br>I'd like to make my own conclusions from the data. That's what the contest is about.<br><br>This seems at odds with the statement of the contest: ""This contest requires competitors to predict the likelihood that an HIV 
patient's infection will become less severe, given a small dataset and 
limited clinical information.""<br><br>",,4.0,,0,0
64,21,650,"2010-05-24 15:21:18","Hi Rajstennaj, I understand you but consider that this is the common problem faced by bioinformaticians every day. To do bioinformatics, you have to know both biology and computer science, otherwise it is very difficult to obtain useful results. This is the reason why I came here in this forum to look for help: a good scientist knows that big problems can not be solved by a single mind, you have to interact with people with different skills if you want to obtain real results.<br><br>You can also approach this competition without knowing anything of biology. I think that it will be very interesting to see if programs written without an a priori knowledge of the problem will perform better than those that make use of these informations. The informations stored in that database are derived from observations made with respect of certain HIV therapies, and it is not certain that they will be applicable to the therapy studied in this competition.<br><br><br>",,5.0,,0,0
65,21,478,"2010-05-24 15:21:18","<span class=""Apple-style-span"" style=""font-family: Helvetica, Arial, Geneva; font-size: 13px; line-height: 15px; "">Rajstennaj,</span><div><span class=""Apple-style-span"" style=""font-family: Helvetica, Arial, Geneva; font-size: 13px; line-height: 15px; ""><br></span></div><div><span class=""Apple-style-span"" style=""font-family: Helvetica, Arial, Geneva; font-size: 13px; line-height: 15px; "">I don't see the distinction between knowing the translation matrix of nucleotides to amino-acids and finding a database which implies that specific regions are more important than others. &nbsp;The Stanford database (and their automated annotation webtool) referenced above is in the top google results when you search for ""HIV Therapy prediction techniques"". &nbsp;I imagined people would stumble upon this website (or any other that could be found from a simple google-search) and use the results as just another featureset in the prediction methods.</span></div><div><span class=""Apple-style-span"" style=""font-family: Helvetica, Arial, Geneva; font-size: 13px; line-height: 15px; ""><br></span></div><div><span class=""Apple-style-span"" style=""font-family: Helvetica, Arial, Geneva; font-size: 13px; line-height: 15px; "">I would be surprised by any machine-learning researcher who didn't do even a general survey of current techniques, available datasets, data transformation and normalization methods that apply to the field.</span></div><div><font class=""Apple-style-span"" face=""Helvetica, Arial, Geneva"" size=""3""><span class=""Apple-style-span"" style=""font-size: 13px; line-height: 15px;""><br></span></font></div><div><font class=""Apple-style-span"" face=""Helvetica, Arial, Geneva"" size=""3""><span class=""Apple-style-span"" style=""font-size: 13px; line-height: 15px;"">The other reason I'm not worried about the knowledge of mutation regions is that the techniques that solely use this data barely reach 65% accuracy on this dataset. By reducing the information in the sequence to a vector of ~20 binary calls (most of which have negligible correlation with the response variable) you will ultimately have difficulty fitting a model ... trust me I've tried.</span></font></div>",,6.0,,0,0
66,21,650,"2010-05-24 15:21:18","Anyway, I take the opportunity to say that the link given to the lanl.gov database in the Background section of this competition is wrong. The right link should be http://www.hiv.lanl.gov/content/sequence/HIV/mainpage.html , and once you are on that site, be sure to look at the Sequence compendium http://www.hiv.lanl.gov/content/sequence/HIV/COMPENDIUM/compendium.html .<br><br><br>I have already contacted the author of the lanl.gov database and they told me that it is not longer maintained. It is better to use the Stanford's one: <br>- http://hivdb.stanford.edu/<br><br>I will tell the maintainers of the lanl.gov database about this website, let's see if they will come in this forum.<br mce_bogus=""1"">",,7.0,,0,0
86,21,673,"2010-05-24 15:21:18","<span class=""Apple-style-span"" style=""font-family: Helvetica,Arial,Geneva; font-size: 13px; line-height: 15px;"">Hi Rajstennaj,<br>The most important reason that detailed knowledge of drug resistant mutations will not be much help is that we are not given the treatment the patients received, nor even told if they received treatment.<br>Regards,<br>Bruce<br></span>",,8.0,,0,0
70,22,926,"2010-05-26 08:11:51","How do you explain the correlation between resp and patient id?<br mce_bogus=""1"">",,1.0,,0,0
71,22,650,"2010-05-26 08:11:51","Just random, there are no biological consequences from that correlation.<br mce_bogus=""1"">",,2.0,,0,0
85,23,882,"2010-05-29 20:58:32","Inspired by the work of <a mce_href=""http://kaggle.com/view-postlist/forum-1-hiv-progression/topic-12-quickstart-package/task_id-2435"" href=""http://kaggle.com/view-postlist/forum-1-hiv-progression/topic-12-quickstart-package/task_id-2435"">Rajstennaj 
Barrabasin developing a perl quickstart package</a> I have just finished putting together a python quickstart package.<br><br>Details are available on <a mce_href=""http://jonathanstreet.com/blog/kaggle-predict-hiv-progression"" href=""http://jonathanstreet.com/blog/kaggle-predict-hiv-progression"">the blog post I've just put up</a>.&nbsp; If you have any questions or find any bugs post them here or on the blog and I'll try to answer / fix them.<br><br>I hope it is useful to some of you.<br>",,1.0,,0,0
87,24,978,"2010-05-31 13:30:13","Hi all,<br><br>I'm new to this contest, and am participating not as a serious competitor but just to get familiar with genetic analysis and machine learning. I've been playing around with the dataset, and I see viral load at t0 is highly correlated with survival chances. I've implemented this in my entry (and nothing else), but I still don't get above guessing. Did I do it wrong or is something else going wrong?<br><br>Thanks,<br><br>Coffin<br mce_bogus=""1"">",,1.0,,0,0
88,24,728,"2010-05-31 13:30:13","I haven't done that exact comparison, but you _should_ be getting above random. &nbsp;The test set is split very close to 50/50 between responders and non-responders, so the first place I'd start is to make sure that your submissions (both the random and the VL) also use a 1:1 ratio of responders to non-responders, just to make sure you're comparing apples to apples.",,2.0,,0,0
94,24,703,"2010-05-31 13:30:13","Sort the test data by viral load, then set the 1st half to respond and the 2nd half to non-respond.<br><br>That will get an MCE of 61.0577.<br><br>You might be interested in the graph (reproduced below) posted as part of the quickstart package. This was calculated from the training data, which has 20% responded versus 80% non-responded. Note that the test data is 50/50.<br><br>&nbsp;<img alt=""Viral Load vs. Pct responded"" src=""http://www.okianwarrior.com/Enjoys/Kaggle/Images/ViralLoadPct2.gif"" mce_src=""http://www.okianwarrior.com/Enjoys/Kaggle/Images/ViralLoadPct2.gif"">",,3.0,,0,0
