Id,ForumTopicId,AuthorUserId,PostDate,Message,ReplyToForumMessageId,TopicMessagePosition,RawMarkdown,Score,FlaggedCount
1,1,478,"2010-04-28 23:13:08","<div>In response to a comment on the No Free Hunch Blog <a href=""http://kaggle.com/blog/2010/04/27/beating-up-on-hiv/"" mce_href=""http://kaggle.com/blog/2010/04/27/beating-up-on-hiv/"">here </a>and on my website <a mce_href=""http://www.willdampier.info/2010/a-few-ideas/"" href=""http://www.willdampier.info/2010/a-few-ideas/"">here</a> ... I'm listing a few ideas that may give you a head-start on how to get started:</div><div><br></div><div>There are a whole lotta ways to do this sort of prediction, since I come from a machine-learning background I'll describe it from that perspective: &nbsp;So in my mind I need to extract a set of features (observations) from each sequences, then train a SVM, logistic-regression, decision-forest, or ensemble classifier to learn which features are important. &nbsp;Each of those classifiers have advantages and disadvantages that are very well documented ... a safari through Wikipedia should give you a pretty good idea.</div><div><br></div><div>The hardest part is deciding which features are worth (or even possible) to put into your model:</div><div><br></div><div>I know people who use ""k-mers"" as their features ... this involves finding and counting all of the 5 letter instances in the sequence. &nbsp;Then you can use these as features in a prediction model. &nbsp;K-mers are nice because they are easy to pull out with any programming language you can think of. There is also a list of regular-expressions which have some biological meaning here: http://elm.eu.org/browse.html</div><div><br></div><div>Other people prefer to use the raw sequence. &nbsp;If you can align the sequences (since they don't all start at the same part of the gene) using a program like ClustalW then you can think of each column as a categorical feature. &nbsp;The problem here is that HIV-1 is highly variable and alignments are difficult ... although not impossible.</div><div><br></div><div>If you wander around the Los Alamos HIV-1 database you can find a list of known resistance mutations: http://www.hiv.lanl.gov/content/sequence/RESDB/. &nbsp;These have been verified to be important in the viral resistance to certain drugs. &nbsp;You can use the presence or absence of these mutations as features to train a model.</div><div><br></div><div>I'm sure there are dozens of ways to extract features that I've never even heard of so don't think that these are your only choices.</div>",,1.0,,0,0
76,1,808,"2010-04-28 23:13:08","Use a mixture of different models (linear regression, neural networks). Choosing the best model by using the wave criterion. The theoretical grounding of the criterion is based on Bayes Theorem, the methods of cybernetics and synergy. See, article ""Performance criterion of neural networks learning"" published in the ""Optical Memory &amp; Neural Networks"" Vol. 17, number&nbsp; 3. pp. 208-219.&nbsp; DOI:10.3103/S1060992X08030041<br>http://www.springerlink.com/content/t231300275038307/?p=0c94471924774e8894973ad3c0d391a7&amp;pi=0<br mce_bogus=""1"">",,2.0,,0,0
116,1,1486,"2010-04-28 23:13:08","My first thoughts on this problem are that it would be ideal for Geof Hinton's deep belief networks.<br><br>http://www.scholarpedia.org/article/Deep_belief_networks<br><br>They are generally competetive at tasks such as high level feature detection in images and audio. Quite possibly though there isn't enough data available to use this approach - not sure.<br><br>Is anyone using this approach?<br mce_bogus=""1"">",,3.0,,0,0
119,1,703,"2010-04-28 23:13:08","The theory of deep belief networks is probably a correct description of information encoded in the human brain, but it's not a complete theory.<br><br>As such, you will have difficulty using it to solve <b>any</b> problem, much less this one.<br><br>Deep belief network theory fails because it does not imply how many layers or variables there should be.<br><br>Certainly, someone could implement a network with a chosen number of layers and variables that ""seem right"". Depending on how well your model represents the correct encoding the results will show anywhere from random to perfect correlation.<br><br>...and there are many, many more configurations with random correlation than perfect correlation.<br><br>(That a wrong feature in the model will push the output towards randomness is the big number one reason why machine algorithms require a ton of data and then only show weak results. For comparison, the human brain will correlate from three samples and is usually correct.)<br><br>As for this particular problem, it's not clear that deeply hidden features with complex dependencies are even needed. Chances are basic observations about the data will be sufficient.<br><br>Additionally, from an information theoretic point of view, well over half of the information needed to find a correlation was moved into the test set where we can't see it. This makes finding correlations extremely difficult, and any which are found will probably be weak at best.<br><br>(Future events may prove me wrong, but I have good evidence for this last statement.)<br><br mce_bogus=""1"">",,4.0,,0,0
130,1,1486,"2010-04-28 23:13:08","Going by Hinton's last two google techtalks, recent results have been very strong. Yes the topology is manually selected, but that's not a show stopper, quite clearly less structure forces generalisation and one can plot the curve of how performance changes with # of nodes and use that to make estimated guesses about the approximate location of a sweet spot.

I take the point that deep features may not be useful here, but that's not a certainty. However, I do very much doubt there is enough data to find anything other than 'surface'  features.

On the last point - It was an interesting aspect of the netflix prize that folks were able to use the available test data in the training algorithm despite not having the hidden part of the data. I believe that all of the top teams integrated this data to improve their models of the data overall. I wonder if a similar approach could be used here. E.g. deep belief nets model the data initially without any need (in this HIV task) for the responder flag. For netflix this was perhaps an unexpected loophole which remained open (probably because the workaround is to submit an algorithm rather than predictions, which would have been unworkable).",,5.0,,0,0
131,1,703,"2010-04-28 23:13:08","I believe I understand deep belief nets well enough to implement one to look for correlations in the response data.<br><br>My first real submission was analogous to a belief net with two layers. It got very good results on the training data - around 68% on the first attempt - but failed miserably on the testing data.<br><br>After spinning my wheels for several weeks trying to tweak the model to better fit the data, I finally wrote some code to detect selection bias in the test set.<br><br>It turns out that the test set suffers from enormous selection bias, and this is why I believe that any model based on the training set will only loosely predict the test data.<br><br>Here's an example. Plotting RTrans length (actually, the ""tail"" length after the main body) shows a section which is 100% Non-Responded. There are 74 patients in this section, and the chances of this happening due to chance is less than 1 in 25 million.<br><br>Ordinarily this would be a strong indicator of patient response which should be incorporated into the model. There are 24 such patients in the test set, and if the correlation holds all should be set to non-respond.<br><br><br mce_bogus=""1"">

<img alt=""RTrans Length vs Responded"" src=""http://www.okianwarrior.com/Enjoys/Kaggle/Images/RTransLength.png"" mce_src=""http://www.okianwarrior.com/Enjoys/Kaggle/Images/RTransLength.png""><br><br><br>I don't have access to the test data, but I *believe* that selection bias has put all of the ""responded"" patients from this sub-population into the test set. Meaning, that there is no way to measure the relevance of this feature from the training data alone.<br><br>I have identified a couple of these anomalies.<br><br>My current system works within the selection bias and is having much 
better results.<br><br><br>",,6.0,,0,0
135,1,1486,"2010-04-28 23:13:08","Thanks Rajstennaj. That's a very odd bias, and given your experience with poor initial test results I don't doubt it. 
It would be interesting to get some feedback on this from the organisers, perhaps after the competition has finished.

I guess it's slightly unfortunate that the novel techniques required to compete on a task like this are overshadowed by the need to do some simpler statistical analyses before you get started proper, but that's real world data for you :)",,7.0,,0,0
148,1,1486,"2010-04-28 23:13:08","Rajstennaj, congrats on your progress so far. 76+ is a very promising and interesting score. Looking forward to learning more about your approach(es) after the end of the competition.",,8.0,,0,0
151,1,703,"2010-04-28 23:13:08","Heh.<br><br>I've got almost 10,000 lines of code so far in perl (a highly expressive language) and 6 separate models which don't work on the test data.<br><br>Don't get discouraged by my apparent MCE. It is entirely likely my approach will be declared invalid by the contest organizer. My system identifies weaknesses of the contest data rather than doing real prediction.<br><br>A more interesting result from the leaderboard is ""team sayani"", who got an extremely good score <b>in three attempts</b>. (!)<br><br>Alex (of ""team sayani"") sent me his paper outlining his method. I haven't read it yet - I'm waiting for the contest to end - but I bet he's the one to beat. When he comes back from vacation, that is.<br><br>Grzegorz Swirszcz sent me two of his papers - they were an interesting read. He's won two other data prediction competitions. His papers introduced me to ""ensemble selection"" - a concept of which I was unaware.<br><br>There's been very little discussion about the contest in general, but I know that the people here are accessible and easy to talk to. And there's lots of opportunity to learn new stuff by talking to people.<br><br>It's a pity people don't talk more. I wonder what techniques John Chouchoumis (team hcj) is using?<br><br mce_bogus=""1"">",,9.0,,0,0
152,1,673,"2010-04-28 23:13:08","Rajstennaj, 
I can't say I've spent as much time on this contest as you but it has become clear to me there is serious selction bias in the choice of training and test sets. Another obvious example: 80 of the traing set are missing PR data entirely - none of the test set are missing ALL PR data. I have also seen clusters of PR sequences in the test set that do not occur in the training set. 

This lack of random assignment to training and tests sets is disappointing. We are not looking just for features associated with reponse but also patterns of bias.",,10.0,,0,0
154,1,1486,"2010-04-28 23:13:08","Dividing the data into equally representative sets is always going to be problemtaic for such small numbers of records (in comparison to say the Netflix prize which had half a million user accounts and 17000 movies). 

I suppose my main concern surrounds how much overfitting can occur to the public portion of the test set (quite a lot it would seem) and whether this goes towards the final score. Strictly speaking we should only be scored on the hidden portion (which may be the case) since we have no idea what the biases are in that set and therefore cannot make assumptions. Of course, some may get lucky or may make educated guesses about the biases in that set",,11.0,,0,0
156,1,673,"2010-04-28 23:13:08","Hi Colin,
""Dividing the data into equally representative sets is always going to be problemtaic ...""
It just has to be randomised, or randomised subject to constraints on the numbers of cases/controls assigned to the test and training groups. Machin learning algorithms and statistical learning techniques rely on the training set being REPRESENTATIVE of the test set. Otherwise there's no point in learning.",,12.0,,0,0
157,1,673,"2010-04-28 23:13:08","<p>I'll briefly post a summary of my 20 hours (or so) of work on this. 
I'm a statistician so I prefer to stick to proven methods. <br></p><p><br></p><p>I've used logistic regression with stepwise variable selection and Baysian Information Criterion (BIC) to stop overfitting. I've used simple receiver operating characteristic (ROC) concepts to choose cut points. I've also used cross-validated my entire model building process using n-fold or leave-one-out cross validation. These are robust reliable techniques that: 1) almost always work, 2) prevent overfitting (statistics has a concept called ""inference"" that is enormously valuable here), 3) minimise effort, 4) provide a good guide to model performance on a new test dataset representative of the training dataset. I used the statistical package R for those who are interested.</p><p><br></p><p>

My conclusion is that the test dataset is NOT representative of the training dataset. I absolutely agree with Rajstennaj that the dataset partitioning was not random and is highly biased.

My first fitting attempts used only viral load and CD4 count (both modelled as logs). After using viral load, CD4 count is not a useful predictor. I chose cut-points on the ROC to maximise accuracy on the test dataset, where cases and controls are equally numerous (roughly where sensitivity + specificity is a maximum). I got an MCE (actually accuracy) of 62.5%.</p><p><br></p><p>

My next attempt was what took all the time. I'm not very used to translating sequences (or rather alighing them), and I discovered a few errors in my work through Cory's contributions. Thanks Cory! Then I simply looked for amino acids associated with disease outcome, created indicator variables for the various ""alleles"" at these sites and then ran the variable selection (keeping viral load and CD4 count as possible variables to choose from). My final models had only 8 variables, including viral load. At the appropriate cut-point they predicted an accuracy of 79% - of course this won't happen as the model is built on that dataset. But the cross-validated accuracy was 76% (projected to a dataset balanced in cases and controls). This is what statistical theory would predict I would get if the test dataset was representative of the training dataset. I again got an MCE of 62.5%. <br></p><p><br></p><p>Noting that the 80 patients with missing PR sequence, and ALL in the training dataset, could not have been randomly assigned, I deleted them and tried buiding the model again. I still got an MCE (accuracy) of 62.5%.</p><p><br></p><p> 

I am forced to the same conclusion as Rajstennaj. There is serious selection bias which makes the problem unsuitable for statistical or machine learning approaches. One is forced to ""go fishing"" for bias, and that means submitting solutions based on hypothesised bias and observing the outcome. Great as a game, but of little use in problems that concern me. <br></p><p><br></p><p>So in my view Rajstennaj deserves to win. It is just a shame that the kind of research paper that will come out of this is not the kind Will intended - nor can it be - as the dataset has not been randomly partitioned. <br></p><p><br></p><p>I suspect those who have done better with train-test approach (eg. sayani) have been in some senses lucky in that that chose feature-outcome sets more randomly distributed between the two datsets - viral load is one such predictor. It got me an accuracy (MCE) of 62.5% by itself.<br></p>",,13.0,,0,0
159,1,1486,"2010-04-28 23:13:08","Hi Bruce, I appreciate you describing your approaches and discoveries. It will be intersting to see what the outcome of the competition will be if there really are no other features (or significant features in comparison to the biases) in the data. Are there features that are consistent across test & training data that the leaders could be basing their predictions on? Probably not based on what I've read.

I think it's early days for kaggle and my hope would be that folks don't get disheartened - that the organisers can learn from this and improve the design of future competions. It's an iterative process. 

Also I'd be interested in learning how your (and others) progress on modelling the training data compares with the current best techniques described in the literature.

Colin.",,14.0,,0,0
198,1,1902,"2010-04-28 23:13:08","Training and test data are clearly hand-picked and/or biased somehow. It's like a ""trick question"" in a quiz. I can see how that makes a contest more challenging, but if the purpose is to produce useful results, this just hinders the task at hand.",,15.0,,0,0
205,1,728,"2010-04-28 23:13:08","Well, it's unfortunate that the contest turned out this way, but I *really* hope that when the contest is over, the top people on the leaderboard (Rajstennaj, Flying Pig, sayani) will find some way to test their algorithms in a way that's more comparable with the other literature on the subject.  For example, cross-validation on the whole set.&nbsp;<div><br></div><div>Hopefully those results could be posted or at least linked to on Kaggle -- I'm very curious how much of the increase in MCE here is merely an artifact and how much is a genuine advance in the field.  Rajstennaj's MCE in particular would be astonishing if anywhere close to accurate.</div>",,16.0,,0,0
206,1,368,"2010-04-28 23:13:08","The public leaderboard is only indicative because competitors can use information on their score to get information on a portion of the test dataset. The final results are a) quite different and b) better reflect actual performance.",,17.0,,0,0
211,1,703,"2010-04-28 23:13:08","My MCE values are not accurate. I'm not predicting from the data, I'm working the competition system. Basically, I know how many entries are used to calculate the public MCE and where they are.<br><br>To get around the selection bias, I plan to determine the correct public MCE and use the extra information to make a more accurate prediction based on the test data. It's a long shot.<br><br>I've known from early on that I won't be winning the competition, but the analysis led to interesting results which should inform future contests.<br><br>For example, if you have 100 yes/no questions, how many guesses are needed to determine the answers with certainty?<br><br>In the worst possible configuration you can get to certainty with about 70 guesses on average (ie - 70% of the number of questions). Most situations are not worst possible, these require <b>fewer</b> guesses.<br><br>The reduction from 100% to 70% was important - with it I can just squeak by determining the entire public MCE and have 6 submissions left over.<br><br>I know all but 9 values of the public MCE, and I'm guaranteed to discover at least one new value with each new submittal.<br><br>An interesting statistic: if you sort the test data on Viral Load and set the first half to ""Responded"" you get a public MCE of 61.0577. If this holds across the entire test set, then I can expect 100% of 30% of the data, and 61.0577% of 70% of the data, for a grand total of 72.6% MCE. Not enough to win :-(<br><br>I <b></b>suspect Alex (""team sayani"") will be the winner.<br>",,18.0,,0,0
212,1,1744,"2010-04-28 23:13:08","This has certainly been an interesting problem.  The sets are clearly not random (as has been pointed out numerous times).  However, even with that knowledge - it has been difficult to turn that to an advantage.  I have broken up the combined data into five different groups and have been trying to come up with separate solutions/theories.  <br><br>Of course - this is made more difficult in that one of the groups appears nowhere in the prediction set - and another is present in the prediction set, but not in the area Rajstennaj mentions that will allow me to get feedback by way of score changes.<br><br>Rt184 is supposed to be very important - and it is in the training set, but there are only 7 variation instances in the entire prediction set in the scoring area.  <br><br>Took me a few times before I figured out why my ""improved"" method was having either no effect - or a negative one.<br><br>I don't think 72.6% is that bad (and you have already mentioned some info that leads me to believe an educated guess would get you closer to ~78%)<br><br>Some of this reminds me of that brain teaser about having 7 coins, a balance, and three weighs to guess which one is fake...",,19.0,,0,0
2,2,606,"2010-04-29 15:48:46","Hi, I'm interested in participating in the contest, however I need to know what tools will actually need to be released upon entry.<br><br>I have access to proprietary software and super computing power, but if our predictions work well we cannot hand over our platform. <br>We can describe it and possibly even release a model that can be simulated by users, but the platform itself is trademarked and licensed.<br><br>Please let me know as I would really like to make a contribution to this project!<br><br>Thanks,<br>-Tanya<br mce_bogus=""1"">",,1.0,,0,0
3,2,478,"2010-04-29 15:48:46","Tanya,<div><br></div><div>Good to hear from you. &nbsp;Since we plan to publish at least the top-entry in a peer-reviewed manuscript we would need a reproducible description of the algorithm. &nbsp;If you can describe it in psuedo-code I'm sure I could implement it in Python for the actual publication. &nbsp;Even if it takes weeks to search the feature-space without your super-computer then that's okay.</div><div><br></div><div>However, if even the algorithm is proprietary and the company isn't willing to allow its publication then I'm sorry but your outta luck.</div><div><br></div><div>-Will</div>",,2.0,,0,0
4,2,368,"2010-04-29 15:48:46","Hi Tanya, <br><br>Kaggle will maintain a rating system. If you win but you're ineligible for prize money, you will still get a strong rating.<br><br>Anthony<br mce_bogus=""1"">",,3.0,,0,0
5,3,634,"2010-04-30 14:32:29","Hi,<br><br>I just read in csv files and I've got a question about the PR and RT sequences. The first one (PR) is 297 characters and the RT is 1476 characters and since I am not from the biomedical field I just wanted to double check.<br><br><br>Regards,<br><br>Alberto<br><br><br>P.S.<br><br>Nice morete seoi nage or perhaps ippon seoi nage (not sure though)<br>",,1.0,,0,0
8,3,478,"2010-04-30 14:32:29","The difference in size between the RT and PR protein segments is correct. &nbsp;These are two different genes in the HIV-1 genome. &nbsp;There are instances in this dataset in which there is no RT or no PR sequence (I've taken out any patients that are missing both). &nbsp;This does not mean that the gene is missing, it means that they didn't measure it. &nbsp;So you'll have to make sure your classifier is robust to missing features.<div><br></div><div>And its an ippon-seonage .. my morote is terrible for both myself and my uke ;)</div>",,2.0,,0,0
41,3,864,"2010-04-30 14:32:29","<meta http-equiv=""content-type"" content=""text/html; charset=utf-8""><span class=""Apple-style-span"" style=""font-family: Helvetica, Arial, Geneva; font-size: 19px; line-height: 22px; "">I have a question: how do you infer that RT is 1476-chars long? the field length goes from 579 to 1482 in the training data.&nbsp;</span><div><span class=""Apple-style-span"" style=""font-family: Helvetica, Arial, Geneva; font-size: 19px; line-height: 22px; ""><br></span></div><div><span class=""Apple-style-span"" style=""font-family: Helvetica, Arial, Geneva; font-size: 19px; line-height: 22px; "">And what's the reason for having so many incomplete RTs? sequencing errors?</span></div>",,3.0,,0,0
6,4,638,"2010-04-30 15:40:57","It seams that the <b>training</b> dataset contains about 80% of patients not responding to treatment while the <b>test</b> dataset seams to contain around 50% of none responding patients. I hence conclude that the training set is not a uniform sample of the total number of patients. Is this done on purpose ?",,1.0,,0,0
7,4,478,"2010-04-30 15:40:57","The dataset is limited by the total number of HIV-1 samples with sequence and&nbsp;therapeutic&nbsp;information in the public domain. &nbsp;And this dataset has virtually all of them. &nbsp;The entire dataset is skewed towards non-responders since the data is mostly from the 1980's-1990's when most therapies were less effective then they are today.<div><br></div><div>The dataset was intentionally split to ensure that the testing dataset is 50-50 responders vs. non-responders, the training set is everything that remains. &nbsp;This was done to ensure that competitors don't ""artificially"" lower their ""responder"" prediction rate because they know the dataset is biased.</div><div><br></div><div>Some biological datasets are even more biased than this one (protein-protein interaction datasets are highly biased towards ""negative"" data). A common way to ensure that you have a robust classifier is to test against a 50-50 training set in which you have&nbsp;artificially&nbsp;created an even distribution of positive and negative events.</div>",,2.0,,0,0
9,4,673,"2010-04-30 15:40:57","Is the test dataset drawn from the same population as the training dataset? Otherwise the predictions made will not be valid.<br mce_bogus=""1"">",,3.0,,0,0
