Id,ForumTopicId,AuthorUserId,PostDate,Message,ReplyToForumMessageId,TopicMessagePosition,RawMarkdown,Score,FlaggedCount
13,4,650,"2010-04-30 15:40:57","The individuals in the dataset are all humans, are all being recently infected by HIV and they received the same treatment.<br><br>Welcome to the problems faced in science... you can't really know whether the two samples come from the same population, e.g. if the viruses that infected them come all from the same strand, if the indivuals have similar genomes... there are a lot of informations that you won't never know.<br mce_bogus=""1"">",,4.0,,0,0
10,5,673,"2010-05-01 11:00:57","Some of the nucleotide codings - I've spotted an ""N"", a ""Y"" and an ""M"" already - are not from the standard ACGT set.<br><br>What do they represent?<br><br>Also HIV is a retrovirus (hence the Reverse Transcriptase protein). Retroviruses are RNA viruses, which means the are usualyy coded with ACGU not ACGT - the U represents uracil found in RNA instead of thymine:<br>http://en.wikipedia.org/wiki/RNA<br><br><br>",,1.0,,0,0
12,5,650,"2010-05-01 11:00:57","'N' means that a base can be either A,C,G or T, and problems in the sequencing process have not permitted to identify which one is the correct base for sure.<br><br>In the same way, Y means a pyrimidine, which is C or T.<br><br>You can find the correct IUPAC convention here:<br>- http://www.dna.affrc.go.jp/misc/MPsrch/InfoIUPAC.html<br><br mce_bogus=""1"">",,2.0,,0,0
11,6,650,"2010-05-01 11:56:47","my background is from biology and, even if I have been doing bioinformatics for a few years now, I don't have enough knowledge of machine learning to solve this by myself: therefore, if someone is interested in making a two-people team with me, I would be glad to collaborate, provided that you explain the machine learning part to me.<br><br>In any case, since I am more interested in learning than in the prize of the competition, I will put here some ideas for everybody:<br><ul><li>the two sets of sequences represent coding sequences of two proteins; therefore, one thing to do is to translate them and compare the protein sequences. Even if two individuals have different DNA sequences for a gene, they can have the same protein sequences; and since only the protein is exposed to functional constraints, then it will be more interesting to see the differences in the protein sequences.<br></li><li>analyzing k-mers doesn't seem very interesting to me. k-mers are usually used to identify regulatory motifs in DNA, which define when a gene is expressed, how, etc.. However, these signals usually are not inside the coding part of a gene sequence, but rather in the positions before or sorrounding the gene. So, the regulatory factors that you are looking with k-mers could be not included in the sequences given. For a similar reason, the GC content is not so informative.<br></li><li>a possible approach would be to look at which sites are the most variable within the protein sequences.<br></li></ul>",,1.0,,0,0
47,6,882,"2010-05-01 11:56:47","I'm in a similar position.&nbsp; I'm comfortable with the biological concepts but the machine learning is all new to me.<br><br>Judging from your other post it looks like we're both intending to use python as well.&nbsp; It's not exactly the ideal skills match but perhaps there is still some scope for cross-fertilization of ideas.&nbsp; Get in touch if you're interested.&nbsp; Email sent to jonathan @ the domain in my profile should reach me.<br mce_bogus=""1"">",,2.0,,0,0
53,6,703,"2010-05-01 11:56:47","Don't get hung up because you don't know machine learning. Machine learning won't get you anything you don't already know about the problem.<br><br>Machine learning is used to predict patterns in future data given past data, and it's nothing more than an application of concepts you already know.<br><br>To use a machine learning system, you would feed it patients one at a time and have it learn to classify respond and non respond based on prior data. Once trained, you would have it try to classify the test data.<br><br>The algorithm would have poor results at the beginning, and get better with training.<br><br>In this case, we know all the data at the outset, so it makes no sense to train. It will be far more efficient and accurate to just take all the data at once and look for significant features. That's only what a machine learning algorithm would do anyway, but over time and incrementally.<br><br>For example, gradient descent (a machine learning algorithm) is equivalent to linear regression. Since you have all the data, you can get the same output by just calculating the linear regression.<br><br>It will be much more effective to just rummage around in the whole dataset using percentages and statistical inference.<br><br mce_bogus=""1"">",,3.0,,0,0
75,6,808,"2010-05-01 11:56:47","Use a mixture of different models (linear regression, neural networks). Choosing the best model by using the wave criterion. The theoretical grounding of the criterion is based on Bayes Theorem, the methods of cybernetics and synergy. See, article ""Performance criterion of neural networks learning"" published in the ""Optical Memory &amp; Neural Networks"" Vol. 17, number&nbsp; 3. pp. 208-219.&nbsp; DOI:10.3103/S1060992X08030041<br>http://www.springerlink.com/content/t231300275038307/?p=0c94471924774e8894973ad3c0d391a7&amp;pi=0<br mce_bogus=""1"">",,4.0,,0,0
81,6,703,"2010-05-01 11:56:47","I don't have access to SpringerLink.<br><br>Can you post a link to your paper that can be read for free?<br><br>(Alternately - Can someone hook me up to SpringerLink somehow?)<br><br mce_bogus=""1"">",,5.0,,0,0
83,6,808,"2010-05-01 11:56:47","<span id=""result_box"" class=""short_text""><span style="""" title="""">Write to me. </span><span style="""" title="""">I shall send you by e-mail.</span></span>",,6.0,,0,0
14,7,478,"2010-05-02 14:37:35","Now that we have a handful of algorithms that are well above random, does anyone want to post a discussion on their particular algorithm, feature-set, approach, etc.<br><br>I'm hoping to foster an open discussion of the techniques used here. You can post a link to a public repo, a blog post, etc.<br><br>Good Luck,<br>Will&nbsp; <br mce_bogus=""1"">",,1.0,,0,0
15,8,638,"2010-05-04 09:32:54","The goal of the game is to answer the question ""Do patients respond to the treatment ?"". However, I have found almost no information about the aforementioned&nbsp;treatment and drugs the patients were given. Did they all follow the same therapy ? Was the posology strictly equivalent ? What drugs exactly were consumed ?",,1.0,,0,0
16,8,650,"2010-05-04 09:32:54","Look at the description in the Data section:<br><br>""""""These sequences are from patients who had only recently contracted HIV-1
 and had not been treated before""""""<br><br>moreover, I think you can assume that the posology has been respected correctly.<br mce_bogus=""1"">",,2.0,,0,0
17,8,478,"2010-05-04 09:32:54","<blockquote><p>The dataset contains many different therapies.&nbsp; I have
ensured that there is an equal proportion of therapies distributed
between the testing and training datasets.&nbsp; For example, if the
training dataset is 30% AZT users then the testing dataset is also 30%
AZT users.&nbsp; The difficulty with breaking out the dataset by therapeutic
intervention is that the ""cocktail"" of drugs given to each patient is
not universal.&nbsp; There are 13 drugs which are given in combination of
1-3 at a time.&nbsp; If I limited the dataset to the largest dug only (AZT
in this case) then you'd be stuck with a training and testing dataset
of barely 200 patients.</p><p>There have been numerous publications
which can ""to some degree"" predict which therapies will work for which
patients ... based on their viral genome.&nbsp; The more interesting
question is ""Are there markers which indicate good progression
independent of the therapy chosen.&nbsp; I arranged the dataset to
facilitate that question.</p><p>As far as the dosages given to the
patients .. even I don't know that information.&nbsp; I can only assume that
doctors were prescribing the proper dosage.&nbsp; There is an issue with
patient ""compliance"" ... many of the earlier drugs made you pretty sick
(and were very expensive) and so patients would take less then the
recommended dosage so it would last longer.&nbsp; If the study directors
noticed that patients were being non-compliant then they'll often drop
them from the study (since they make the numbers worse), but I have no
data indicating the level of compliance.</p><p>Hope that helps,</p><p>Will</p></blockquote>",,3.0,,0,0
18,9,672,"2010-05-05 04:00:15","Hi there,<br><br>The Fontanelles is a group which does HIV research professionally and so has some specialized information in this area. We're disqualifying our entry, but have put it in just for fun as a target.&nbsp; We may be back if someone beats it.<br mce_bogus=""1"">",,1.0,,0,0
19,9,478,"2010-05-05 04:00:15","Good to hear from you Paul,<br><br>I saw your entry just a little while ago and I noticed that you were listed yourself as a clinical virologist.&nbsp; If you'd like to talk about your methods I'd be glad to hear them.&nbsp; If your interested in writing a guest-post for my blog on this competition feel free to drop me an e-mail.<br><br>Thanks,<br>Will<br mce_bogus=""1"">",,2.0,,0,0
20,10,634,"2010-05-06 13:56:24","Hi guys,<br><br>Apologies in advance if this is a silly question but I feel like a fish out of the water with this PR and RT strings.<br><br><br>I have been spending sometime on the PR and RT sequences and noticed that if I split the sequences in 3-mers I'll get 99 groups for PR (297/3) and 492 for RT (1476/3). My question is whether or not make sense to split the sequences in ternaries. Is there any other alternative, perhaps 2-mers?<br><br>Does it make sense to calculate the odds of&nbsp; responding to the treament for each k-mer or may be re-group them into 2 consecutive k-mers and the calculate the odds?<br><br>Thanks in advance for your help.<br><br>Alberto<br mce_bogus=""1"">",,1.0,,0,0
22,10,703,"2010-05-06 13:56:24","You probably know this, but in case you don't here's some info which might help your analysis.<br><br>The nucleotide sequence is used by the cell to build a protein, and proteins are made up of a string of amino acids.<br><br>The cell structure (ribosome) takes the nucleotide sequence in groups of three letters. Each grouping of three letters indicates which is the next amino acid to attach to the growing chain which makes up the protein. Once the chain is complete, the protein is let go and it folds over and around itself to make a single molecule with a specific shape.<br><br>(I'm glossing over some details. The folding actually happens as the string is being created, and there may be other steps in the process such as chopping off sections after the protein is made.)<br><br>For example, the following nucleotide sequence:<br><br>CCTCAAATCACTCTTTGGCAACGACCCCTCGTCCCAATAAGGATAGGG...<br><br>will be interpreted by the ribosome as this:<br><br>CCT CAA ATC ACT CTT TGG CAA CGA CCC CTC GTC CCA ATA AGG ATA GGG ...<br><br>and the protein generated will be this<br><br>Proline+Glutamine+Isoleucine+Threonine ...<br><br>The lookup tables for these translations can be found in numerous places on the net under the term ""Genetic Code"".<br><br>There are 4 possible nucleotides in 3 positions within such a triplet, giving a total of 64 possible codons. Three of these mean ""Stop"", one of these is conditionally ""Start"", and each of the others indicate one of 20 amino acids.<br><br>This means that there is redundancy in the genetic code: Both TTT and TTC encode Phenylalanine, so two nucleotide sequences which differ in the same position by these codons will generate identical proteins.<br><br>Furthermore, some common-sense logic can be applied to the sequences. If there is a codon with missing information ""TG?"" and it's in the middle, the unknown codon is almost certainly not ""TGA"" because you won't normally have a ""STOP"" codon in the middle of the sequence.<br><br>If you are going to do correlations on the nucleotide sequence as a generic string, you can first translate the sequence into a string of amino acids and work with *that* as a string. This will automatically match the redundancies in the genetic code and result in a string 1/3 as long.<br><br><br>Any biologists who note an error in the previous, please reply with a correction.<br><br mce_bogus=""1"">",,2.0,,0,0
24,10,650,"2010-05-06 13:56:24","Rajstennaj, what you have written is correct.<br><br>I don't believe it is very useful to look at k-mers distribution, it is better to concentrate on variability on certain positions..<br>",,3.0,,0,0
21,11,737,"2010-05-06 21:19:20","Hello,<br><br>We developed string kernels for HIV in 2008, so you might want to check that.<br><br><a mce_href=""http://www.retrovirology.com/content/5/1/110"" href=""http://www.retrovirology.com/content/5/1/110"">http://www.retrovirology.com/content/5/1/110</a><br><br>We are preparing a submission based on that.<br><br>Cheers!<br><br>Mr. Sébastien M. Boisvert, PhD student -- http://boisvert.info/<br><br>edit Thu May&nbsp; 6 18:22:55 EDT 2010: removed irrelevant information.<br mce_bogus=""1"">",,1.0,,0,0
23,12,703,"2010-05-07 20:52:31","<a href=""http://www.OkianWarrior.com/Enjoys/Kaggle/Images/HIV.zip"" mce_href=""http://www.OkianWarrior.com/Enjoys/Kaggle/Images/HIV.zip"">Here</a> is a quickstart package for people to get up and running without a lot of programming.<br><br>It's in perl, you will also need List::Util and Statistics::Basic from CPAN. The data files for this contest are included.<br><br>BasicStats.pl<br><br>This will read in the data and print some basic statistics. You can use this as a framework for your own explorations of the data. The source informs several ways of accessing and manipulating the data.<br><br>TestMethod.pl<br><br>This will randomly select a test set from the training data, then call Train() on the remaining data and Test() on the test data and print out the MCE. Train() and Test() are stubs - rewrite these functions to test your own prediction methods.<br><br>KaggleEntry.pl<br><br>This will read in the test data and the training data, call Train() on the training data, then call Test() on the test data, then generate a .csv file properly formatted for Kaggle submission. Train() and Test() are stubs - rewrite these functions to submit an entry based your own prediction methods.<br><br>There is a more comprehensive README in the package.<br><br>If you find problems, please let me know (via the Kaggle contact link), I will update &amp; repost.<br><br>I expect bugs will be fixed and more functionality will be added over time, updates will be posted here.<br><br>(Please be kind to my server!)<br mce_bogus=""1"">",,1.0,,0,0
31,12,703,"2010-05-07 20:52:31","A new version is available with some enhancements and a minor bug fix, available <a href=""http://www.okianwarrior.com/Enjoys/Kaggle/Images/HIV.zip"" mce_href=""http://www.OkianWarrior.com/Enjoys/Kaggle/Images/HIV.zip"" rel=""nofollow"" rel=""nofollow"" >here</a>.<br><br>A complete description of the changes is included with the package.<br mce_bogus=""1"">

<br>BootstrapMethod.pl<br><br>This will run TestMethod.pl 50 times with different train and test sets, then calculate the mean MCE.<br>Useful if your method has a random component to it. <br><br>
(Per the <a href=""http://en.wikipedia.org/wiki/Bootstrapping_%28statistics%29"" mce_href=""http://en.wikipedia.org/wiki/Bootstrapping_%28statistics%29"">Wikipedia entry</a> on bootstrapping.)<br><br><br>PlotData.pl<br><br>This will generate several data files from the training data, which can then be displayed using gnuplot.<br>Included are several gnuplot scripts to get you started viewing the data in interesting ways, including this:<br><br><br><img alt=""Viral Load vs. Pct responded"" src=""http://www.okianwarrior.com/Enjoys/Kaggle/Images/ViralLoadPct2.gif"" mce_src=""http://www.okianwarrior.com/Enjoys/Kaggle/Images/ViralLoadPct2.gif""><br><br><br><br>Enjoy, and let me know if you find problems.<br>",,2.0,,0,0
32,12,728,"2010-05-07 20:52:31","To contribute to The Cause, here are all of the training and test instances translated from DNA to amino acids, and aligned to the same reading frame with the consensus sequences. &nbsp;Also with some basic proteomics data such as molecular weight, pI, and percentage of helix, turn, and sheet segments, derived from ProtParam --&nbsp;<a href=""http://expasy.org/tools/protparam.html"" rel=""nofollow"" >http://expasy.org/tools/protparam.html</a>) &nbsp;You can download the data here:<div><div><br></div><div>http://dl.dropbox.com/u/3966882/hiv/alignments_and_proteomics.csv</div><div><br></div><div>For the non-biologists: a consensus sequence is sort of the ""average"" or ""standard"" sequence within a database of different sequences, and variations from this consensus are called polymorphisms. &nbsp;So in the above file, there are several hyphens within the training/test sequences where the consensus sequence has an amino acid, but the training/test sequence has a deletion there. &nbsp;The consensus sequences for protease and reverse transcriptase are here:</div><div><br></div><div>http://dl.dropbox.com/u/3966882/hiv/consensus.txt</div></div>",,3.0,,0,0
33,12,703,"2010-05-07 20:52:31","Cory's proteomics data is now included in the quickstart package.<br rel=""nofollow"" ><br>(His distinctiveness was added to the collective.)<br><br>A function to read and add the proteomics to the patient data is included, and all sample programs load the new data.<br><br>BasicStats.pl prints simple statistics based on the proteomics - look there to see how to access the new data.<br><br>(But nonetheless it's straightforward.)<br><br>The new version is <a href=""http://www.okianwarrior.com/Enjoys/Kaggle/Images/HIV.zip"" mce_href=""http://www.OkianWarrior.com/Enjoys/Kaggle/Images/HIV.zip"" rel=""nofollow"">here</a>.<br><br>",,4.0,,0,0
48,12,882,"2010-05-07 20:52:31","The site for the quickstart package seems to be down.<br mce_bogus=""1"">",,5.0,,0,0
49,12,836,"2010-05-07 20:52:31","Working&nbsp; for me now <br>",,6.0,,0,0
50,12,703,"2010-05-07 20:52:31","That's my home server - I turn it off at night [EDT] sometimes.<br><br>If it doesn't work, try again 12 hours later.<br><br mce_bogus=""1"">",,7.0,,0,0
51,12,882,"2010-05-07 20:52:31","Working fine for me as well now.<br><br>Thanks.<br mce_bogus=""1"">",,8.0,,0,0
84,12,717,"2010-05-07 20:52:31","Thanks Raj for the quickstart package and Cory for the proteomics data.<br><br>I noticed for Cory's proteomics data two entries are missing just thought I would add them in if<br>they have not been mentioned already.<br><br>Training data Patient id 659 PR sequence<br>CCTCAGATCACTCTTTGGCAACGACCCGTCGTCACAGTAAAGATAGGGGGGCAACTAAAGGAAGCTCTATTAGATACAGGAGCAGATGAYACAGTATTAGAAGACATGAATTTGCCAGGAAGATGGAAACCAAAAATGATAGGGGGAATTGGAGGTTTTGTCAAAGTAAGACAGTATGATCAGGTACCTATAGAATTTTGTGGACGTAAAACTATGGGTACAGTATTAGTAGGACCTACACCTGTCAACGTAATTGGAAGRAATCTGTTGACTCAGATTGGGTGCACTTTAAATTTT<br><br>Translation<br>PQITLWQRPVVTVKIGGQLKEALLDTGADXTVLEDMNLPGRWKPKMIGGIGGFVKVRQYDQVPIEFCGRKTMGTVLVGPTPVNVIGXNLLTQIGCTLNF<br><br>Test data Patient id 674 RT sequence<br>CCCATTAGTCCTATTGAAACTGTRCCAGTAAAATTAAAGCCAGGAATGGATGGCCCAAGAGTTAAACAATGGCCATTGACAGAAGAAAAAATAAAAGCATTAGTAGAAATTTGTACAGAAATGGAAAAGGAAGGAAAAATTTCAAAAATTGGGCCTGAAAATCCATACAATACYCCAGTATTTGCCATAAAGAAAAAGGACAGTTCYANNNNNNNNNNNNNNNNNNNNNNNNNNNNNNNNNNNNNNNNNNNNNNNNNNNNNNNNNNNNNNNNNNNNNNNNNNNNNNNNNNNNNNNNNNNNNNNNNNNNNNNNNNNNNNNNNNNNNNNNNNNNNNNNNNNNNNNNNNNNNNNNNNNNNTTAGATAAAGACTTCAGAAAGTATRCTGCATTCACCATACCTAGTGTGAACAATGAGACACCAGGGATTAGATATCAGTATAATGTGCTTCCACAGGGATGGAAAGGATCACCAGCAATATTCCAAAGTAGCATGACAAAAATCCTAGAGCCTTTTAGAAAACAAAATCCAGACATAGTTATCTATCAATACATGGATGATTTGTATGTAGGATCTGACTTAGAAATAGGGCAGCATAGAACAAAAATAGAGGAACTGAGAGATCATCTATTGAAGTGGGGACTTTACACACCAGACMAAAAACAYCAGAAAGAACCTCCATTCCTTTGGATGGGTTATGAACTCCATCCTGATAAATGGACAGTACAGCCTATAGTGCTGCCAGAAAAAGACAGCTGGACTGTCAATGACATACAGAAGTTAGTGGGAAAATTGAATTGGGCAAGTCAGATATATCCAGGGATTAAAGTAAGGCAATTATGTAAACTCCTTAGGGGAACCAAAGCACTAACAGAAGTAGTACCATTAACAGAAGAAGCAGAGCTAGAACTGGCAGAAAACAGGGAGATTYTAAAAGAACCAGTACATGGAGTGTATTATGACCCAACAAAAGACTTAATAGCAGAAATACAGAAACAGGGGCTAGGCCAATGGACATATCAAATTTATCAAGAACCATTTAAAAATCTGAAAACAGGAAAGTATGCAARAATGAGGRGTGCCCACACTAATGATGTAAARCAACTAACAGAGGYGGTRCAAAAAATAGCCACAGAAAGCATAGTAACATGGGGAAAGACTCCTAAAYTTAAATTACCCATACAGAAAGAAACATGGGAGGCATGGTGGACAGAGTATTGGCARGCCACCTGGATTCCTGARTGGGAGTTTGTCAATACCCCTCCCTTAGTGAAATTATGGTACCAGTTAGAGAAAGAACCYATAGTAGGAGCAGAAACTTTCTATGTAGATGGGGCAGCTAATAGGGAAACTAAATTAGGAAAAGCAGGATATGTTACTGACAGAGGAAGACAAAAAGTTGTCTCCCTAACGGACACAACAAATCAGAAGACTGAGTTACAAGCAATTAATCTAGCTTTN<br><br>Translation<br>PISPIETXPVKLKPGMDGPRVKQWPLTEEKIKALVEICTEMEKEGKISKIGPENPYNXPVFAIKKKDSXXXXXXXXXXXXXXXXXXXXXXXXXXXXXXXXXXXXXXXXXXXXXXXXXXXLDKDFRKYXAFTIPSVNNETPGIRYQYNVLPQGWKGSPAIFQSSMTKILEPFRKQNPDIVIYQYMDDLYVGSDLEIGQHRTKIEELRDHLLKWGLYTPDXKXQKEPPFLWMGYELHPDKWTVQPIVLPEKDSWTVNDIQKLVGKLNWASQIYPGIKVRQLCKLLRGTKALTEVVPLTEEAELELAENREIXKEPVHGVYYDPTKDLIAEIQKQGLGQWTYQIYQEPFKNLKTGKYAXMRXAHTNDVXQLTEXXQKIATESIVTWGKTPKXKLPIQKETWEAWWTEYWXATWIPXWEFVNTPPLVKLWYQLEKEXIVGAETFYVDGAANRETKLGKAGYVTDRGRQKVVSLTDTTNQKTELQAINLAX<br><br><br>Thanks,<br><br>Jack<br><br mce_bogus=""1"">",,9.0,,0,0
34,18,650,"2010-05-18 16:53:05","There are three sequences that have a stop codon in the middle, so only a portion of them is coding.<br><br>I wonder which is the best way to handle with this. Would you remove the whole sequences from the data? Will you consider the sequence after the stop codon, or not? or maybe it is better to ignore this fact completely?<br><br>I don't know what is the best way to put this information into a machine learning software.<br mce_bogus=""1"">",,1.0,,0,0
35,18,703,"2010-05-18 16:53:05","Some parts of the sequence are highly conserved - they cannot change much (or occasionally, at all) without modifying the function of the protein.<br><br>Look at the same position in all the other sequences. If they all have the same codon, or overwhelmingly most have the same codon, then it's likely that the stop codon is a data error and you can assume it's the overwhelmingly likely case.<br><br>If the codon is in a position which varys widely across all the other samples, then it's in a position which is *not* highly conserved, which means that it's unlikely to matter.<br><br>Also, if you suspect an error in transcription and have more than one possible solution (perhaps all the other sequences have one of two possibilities in that position), you can look at all possible cases of what the codon might be, and then look at the shapes and sizes of the corresponding amino acids.<br><br>For example, you have an error and the possible replacements are Threonine or Tryptophan. If the corresponding codons in the other samples are all Alanine and Serine, then Threonine is the best guess. (Tryptophan is big and bulky, the others are small and similar.)<br><br>Note that in all this, you are finding the <b>most likely</b> answer, not the correct answer.<br><br><br>Any biologists who note an error in the previous, please post a correction.<br><br mce_bogus=""1"">",,2.0,,0,0
36,18,703,"2010-05-18 16:53:05","Also of note, if you read 





Sébastien's paper (from the post about string kernels), they specifically discounted samples that had coding errors.<br><br>From his paper:<br><blockquote><br>Sequences containing #, $ 
or * were eliminated from the dataset. The signification of these 
symbols was reported by Brian Foley of Los Alamos National Laboratory 
(personal communication). The # character indicates that the codon could
 not be translated, either because it had a gap character in it (a 
frame-shifting deletion in the virus RNA), or an ambiguity code (such as
 R for purine). The $ and * symbols represent a stop codon in the RNA 
sequence. TAA, TGA or TAG are stop codons.</blockquote><br><br>http://www.retrovirology.com/content/5/1/110",,3.0,,0,0
37,18,703,"2010-05-18 16:53:05","On the subject of ambiguous data, here are some of my thoughts.<br><br>First of all, the sequences have to be aligned. Once aligned, vast numbers of columns will be highly conserved vertically.<br><br>Given that, we can talk about a particular column within all sequences, with a column being a 3-nucleotide codon. Some sequences are longer/shorter, so some sequences will have blanks at a particular column.<br><br>A codon is a triiplet of (one of four) nucleotides, making a total of 64 possible codons. These code for 20 amino acids, so there is some redundancy. A particular amino acid is likely to be encoded my more than one codon, some of them have 6 codes.<br><br>A first pass might consider duplicate codings as the same. Since they encode the same amino acid, both encodings will generate chemically identical results. One could go through the data and replace all synonyms by some chosen base coding. This will eliminate some of the variation.<br><br>Next, consider a particular column. If the column has the same codon in both data sets, it has no predictive power so it can be eliminated - cut from the sequence. This will shorten the string and make certain computations easier (such as string kernels).<br><br>I've got about 2 more pages of thoughts on the matter. Anyone else want to comment?<br mce_bogus=""1"">",,4.0,,0,0
