Id,ForumTopicId,AuthorUserId,PostDate,Message,ReplyToForumMessageId,TopicMessagePosition,RawMarkdown,Score,FlaggedCount
38,18,650,"2010-05-18 16:53:05","No, I have translated the sequences with the tool transeq from EMBOSS, and I have found some stop codons in the middle of some sequences.<br><br>There is not a specific strand for which all the sequences are completely coding, but with the strand 1 you can translate all the sequences except a few.<br><br>The sequences of the PR protein for individuals 51, 188, 612 and 665 contain a stop codon in the middle, 785. I was asking what is the best approach to handle these cases. Should I consider that the genotype of these sequences is null for all the nucleotides after the stop codon? or should I keep them ignoring the stop?<br><br>@ <a rel=""nofollow"" onfocus=""blur();"" href=""../../../../../Rajstennaj-Barrabas/Profile"" mce_href=""http://kaggle.com/Rajstennaj-Barrabas/Profile"">Rajstennaj Barrabas
						</a>
						: thank you for your feedback: but please, let's try to keep the discussion on the stop codons here, and let's open new discussions for other topics in this forum. <br><br><br><br mce_bogus=""1"">",,5.0,,0,0
39,18,703,"2010-05-18 16:53:05","I'm sorry if my post seemed off-topic. Let me try an example.<br rel=""nofollow"" ><br>
<a href=""http://www.okianwarrior.com/Enjoys/Kaggle/Images/RTrans.html"" mce_href=""http://www.OkianWarrior.com/Enjoys/Kaggle/Images/HIV.zip"" rel=""nofollow"">Here</a> is a list of RTrans sequences for all individuals in the study. Scroll down to patient 408.<br><br>(I've included an excerpt below.)<br><br>The stop codon for patient 408 is at position 12 (shown in red) in the sequence. Looking at that position in all patients, I note that the vast majority of them seem to be AAG. Counting the codons in that position results in the following:<br><pre><br>AAA: 71<br>AAC: 2<br>AAG: 1451<br>AAR: 32<br>AAS: 2<br>ARG: 3<br>MAG: 1<br>TAG: 1&nbsp;&nbsp;&nbsp;&nbsp;&nbsp; &lt;- Stop codon<br>TTA: 1<br>WAG: 1<br>---: 127&nbsp;&nbsp;&nbsp; &lt;- No codon<br></pre><br><br>Most of these are AAG analogues. For example, the ""R"" in AAR above represents A or G, so those 32 entries could reasonably be AAG as well. (And of course, AAA and AAG are synonyms for the same amino acid.)<br><br>My conclusion: given the values in the other samples, and knowing that a stop codon won't appear in the middle, it's reasonable to assume that the stop codon is a data error and that the most likely correct value is AAG.<br><br>The second thing to note is that this end of the sequence is ""ragged"" among all the patients. Many of the sequences begin after this position - they have no codon here.<br><br>This would imply that this position in the sequence is not especially critical to the function of the protein, which gives us circumstantial evidence to believe that changing the TAG to AAG is OK because it won't matter much.<br><br><br>An excerpt from the (very long) HTML file mentioned above:<br><br><br mce_bogus=""1"">

<img alt=""Viral Load vs. Pct responded"" src=""http://www.okianwarrior.com/Enjoys/Kaggle/Images/Stop1.gif"" mce_src=""http://www.okianwarrior.com/Enjoys/Kaggle/Images/Stop1.gif"">",,6.0,,0,0
40,18,703,"2010-05-18 16:53:05","Here's a question for you.

I found 9 stop codons among 7 patients in the Reverse Transcriptase sequence, but none in the Protease sequence. Your post notes fewer stop codons, in the Protease sequence?<br><br>The IDs seem to match yours - am I using the wrong data? Is RT and PR reversed in the data files?<br> 

<pre><br>--Train Data--<br>51 : RT( 10) = TAA<br>188: RT( 37) = TGA<br>612: RT(203) = TAA<br>665: RT(288) = TAA<br>665: RT(291) = TAA<br>665: RT(294) = TAA<br>785: RT( 27) = TAA<br>--Test Data--<br>408: RT( 12) = TAG<br>437: RT(209) = TAG<br></pre><br mce_bogus=""1"">",,7.0,,0,0
42,18,650,"2010-05-18 16:53:05","Hi,<br>sorry for the delay in answering.<br><br>Don't worry, we have the same results: there are three stop codons in sequence 665, toward the end of the seq; and I didn't calculate anything in the test data.<br>So in total, I have 5 sequences with earlier stop codons in the training data, just like you.<br mce_bogus=""1"">",,8.0,,0,0
44,18,650,"2010-05-18 16:53:05","ok, your idea to threat those cases as sequencing errors is nice, but at least in 665 they should be not errors, since there are three stop codons in a close position. Let me think about it..<br mce_bogus=""1"">",,9.0,,0,0
52,18,703,"2010-05-18 16:53:05","For the case of patient 665, note that the length of the RT sequence is not a strict multiple of three. Examining the alignment of the tail end of the sequence against the other sequences, I note that it would line up very well and eliminate the stop codons if an extra nucleotide is inserted.<br><br>Comparing against other sequences, I edited my input data as follows:<br><br><pre>AAAGTAAAGSATTATGTAAACTCRTTAGGGGAACCAAAGCACTAACAGAAGTAATACCATTAACA"",5,78<br>AAAATAAGGCAATTATGTAAACTCCTTAGGGGAGCCAAAGCATTAACAGAAGTAATACAGTTAACGAAAGAAGCAGAG"",3.3,447<br><br><br>AAAGTAAAGSA<font color=""red"">A</font>TTATGTAAACTCRTTAGGGGAACCAAAGCACTAACAGAAGTAATACCATTAACA"",5,78<br>AAAATAAGGCAATTATGTAAACTCCTTAGGGGAGCCAAAGCATTAACAGAAGTAATACAGTTAACGAAAGAAGCAGAG"",3.3,447<br><br></pre>
<br><br>That's just my take. Also, this is at the ragged end section which is not strongly conserved, so chances are good that any changes I make are not important.<br><br>What are your thoughts on this?<br>",,10.0,,0,0
54,18,650,"2010-05-18 16:53:05","The problem is that a deletion of 1 base is also a possibility in nature, and given the fact that we are talking about HIV, it won't be so strange.<br><br>The description of the data in this competition doesn't say anything about the quality of the sequences, and I am not sure whether can argue that there are errors in there. I thought we could assume that the sequences are right, especially given the fact that this is not a real-data problem. From another point of view, the only thing we know is that HIV is highly variable and accumulates a lot of mutations, and for the case of 665 the deletion is toward the end of the sequence and likely to not have consequences on the protein structure.<br mce_bogus=""1"">",,11.0,,0,0
58,18,478,"2010-05-18 16:53:05","I just wanted to chime in here about the ""stop codon"" issue and the discussion of sequencing errors.<div rel=""nofollow"" ><br></div><div>These are sequences from real patients (not simulated sequences).&nbsp;There is an issue with possible sequencing errors but this is an unlikely explanation for finding these stop-codons. &nbsp;Sequencing errors usually result in&nbsp;ambiguous&nbsp;characters like 'N', 'Y', etc.</div><div><br></div><div>In my research I tend to artificially remove these sequences since they are difficult to interpret. &nbsp;Its unclear whether this is actually a mis-sense mutation, a sequencing error, or a poor sampling of the ""<a href=""http://gateway.nlm.nih.gov/MeetingAbstracts/ma?f=102178611.html"" mce_href=""http://gateway.nlm.nih.gov/MeetingAbstracts/ma?f=102178611.html"">quasispecies</a>"". &nbsp;I included them in the dataset in-case anyone had a brilliant idea on how to deal with them.</div><div><br></div><div>Hope that helps,</div><div>Will Dampier</div>",,12.0,,0,0
80,18,924,"2010-05-18 16:53:05","Is the correct interpretation of HIV variability and the quasispecies issue that:<br><br>With respect to the ""validity"" of individual nucleotide/codons - since the HIV virus generates many variants in a single infected patient in the 
course of one day, it would be correct to view the single sequence associated with each patient as a sample from an ever-changing population of virus within that patient.<br><br>If that is true, these independent variable data could be viewed as a sample of the patient's viral population, or as possessing error-in-variables. As such, I'm tempted to try not to discard the entire data point. Rather, it would seem to me that a predictive model that recognizes the viral plasticity would be preferred.<br><br>On a side note, Will's quasispecies reference states ""that the molecular biologist will be able to provide a molecular 
description of HIV induced disease seems remote"" - has that view changed over the intervening 20 years?<br><br>Thanks in advance for educating a non-biologist<br>",,13.0,,0,0
82,18,703,"2010-05-18 16:53:05","In the old days, humans did sequencing by looking at (images of) spots on gels. My guess is that the contest data could be of the older sort and prone to human data entry errors.<br><br>(There's only 12 of these in the entire dataset, and all of them are in sequence areas which are unlikely to matter.)<br><br>As far as ambiguous codons go, my take is that since the genome is so plastic, any sample will necessarily contain multiple genotypes. In that model, an ambiguous codon might represent <b>both</b> species at once.<br><br>For example:<br><br>ARA &lt;- AAA Lysine AGA Arginine<br><br>Both genotypes in the original sample in roughly equal numbers would cause this type of ambiguity. A good correlation method should give weight to both possibilities.<br><br>Any Biologists want to confirm or deny?<br><br mce_bogus=""1"">",,14.0,,0,0
43,19,650,"2010-05-24 09:23:11","I prefer to program in python if I can. Can you recommend me any good library for machine learning in python?<br><br>I have found <a mce_href=""http://pypi.python.org/pypi/pcSVM/pre%201.0"" href=""http://pypi.python.org/pypi/pcSVM/pre%201.0"">pcSVM</a>, but it seems to be not online anymore. So, I don't know libraries to play with support vector machines in python.<br><br>For Neural network there is <img src=""http://pypi.python.org/pypi/ffnet/0.6.2"" mce_src=""http://pypi.python.org/pypi/ffnet/0.6.2""> which looks good, but I haven't tried it yet.<br mce_bogus=""1"">",,1.0,,0,0
45,19,650,"2010-05-24 09:23:11","<a mce_href=""http://www.csie.ntu.edu.tw/~cjlin/libsvm/"" href=""http://www.csie.ntu.edu.tw/%7Ecjlin/libsvm/"">LIBSVM</a>, with interfaces to Python and other languages.<br mce_bogus=""1"">",,2.0,,0,0
46,19,882,"2010-05-24 09:23:11","I also prefer using python.&nbsp; I haven't used any of the following (yet) but might give you some additional options to look into.<br><br><a mce_href=""http://pybrain.org/"" href=""http://pybrain.org/"">http://pybrain.org/</a><br><a mce_href=""https://mlpy.fbk.eu/"" href=""https://mlpy.fbk.eu/"">https://mlpy.fbk.eu/</a><br><a mce_href=""http://pyml.sourceforge.net/"" href=""http://pyml.sourceforge.net/"">http://pyml.sourceforge.net/</a><br><br>You're probably already aware of it but there is also <a mce_href=""http://biopython.org/wiki/Main_Page"" href=""http://biopython.org/wiki/Main_Page"">Biopython</a> which while not a machine learning library should be useful.<br mce_bogus=""1"">",,3.0,,0,0
55,20,650,"2010-05-24 15:19:35","This post is not related to the HIV Progression contest, but it is to send feedback about the Kaggle website.<br><br>First of all, you should really use a better code for the forum... it is very uncomfortable to write here, and there are a lot of templates out there that work better.<br><br>The second point is a more general complaint about the fact that having a prize for solving the competition reduces a lot the opportunity to collaborate to solve the problem together with other people. For example, I have some good ideas on which informations I could use to write a nice machine-learning method to make the prediction... but I am restrained from exaplaining them here because I won't obtain any credit from it :-(<br><br>You should think of a way to reward the people most active in the forum, or in any case you have to reward those that collaborate the most and are more open to the dialogue.<br mce_bogus=""1"">",,1.0,,0,0
57,20,882,"2010-05-24 15:19:35","You might want to send this to the developers directly using the 'contact us' at the bottom right of the screen as well.&nbsp; I contacted them a couple of hours ago about a small bug and got a reply back saying it had been fixed minutes later.<br><br>I doubt they can fix all bugs as quick and feature requests will also take longer but they're definitely responsive to feedback.<br mce_bogus=""1"">",,2.0,,0,0
59,20,703,"2010-05-24 15:19:35","I'll second that.<br><br>Anthony, the Kaggle person who deals with site feedback, is very accessible and open to suggestions.<br><br>And he doesn't get angry or put out even if your complaints are snarky. :-)<br><br>(I know this because I've sent 20 E-mails over the last month suggesting improvements and pointing out things.)<br><br>You can contact him from the ""ask us directly"" link under the help page.<br><br mce_bogus=""1"">",,3.0,,0,0
63,20,650,"2010-05-24 15:19:35","Thank you for answering me. <br><br>I will send an email to them when I 
will have time, but I also like when feedback is visible to everyone.<br><br>Do
 you agree with the fact that it may be not convenient to someone to 
collaborate in the forum? That collaboration should be encouraged more?",,4.0,,0,0
67,20,478,"2010-05-24 15:19:35","<span class=""Apple-style-span"" style=""font-family: Helvetica, Arial, Geneva; font-size: 13px; line-height: 15px; "" mce_style=""font-family: Helvetica, Arial, Geneva; font-size: 13px; line-height: 15px; "">Giovanni,</span><div><span class=""Apple-style-span"" style=""font-family: Helvetica, Arial, Geneva; font-size: 13px; line-height: 15px; "" mce_style=""font-family: Helvetica, Arial, Geneva; font-size: 13px; line-height: 15px; ""><br></span></div><div><span class=""Apple-style-span"" style=""font-family: Helvetica, Arial, Geneva; font-size: 13px; line-height: 15px; "" mce_style=""font-family: Helvetica, Arial, Geneva; font-size: 13px; line-height: 15px; "">I've been trying to stimulate discussion about techniques as much as possible however I seem to be shouting into the dark ... as you can see from the empty forum threads on ""Technique discussion"". I was envisioning that people would have public repos that others commented on, modified, etc. but alas. &nbsp;Apart from a mention of ""String Kernels"" which have yet to make an appearance on the leaderboard ;) and a quickstart package made by&nbsp;Rajstennaj there hasn't been much discussion.</span></div><div><span class=""Apple-style-span"" style=""font-family: Helvetica, Arial, Geneva; font-size: 13px; line-height: 15px; "" mce_style=""font-family: Helvetica, Arial, Geneva; font-size: 13px; line-height: 15px; ""><br></span></div><div><span class=""Apple-style-span"" style=""font-family: Helvetica, Arial, Geneva; font-size: 13px; line-height: 15px; "" mce_style=""font-family: Helvetica, Arial, Geneva; font-size: 13px; line-height: 15px; "">It seems people are willing to discuss questions about the data, since that's helpful to everyone, but exact implementations are lacking.</span></div><div><span class=""Apple-style-span"" style=""font-family: Helvetica, Arial, Geneva; font-size: 13px; line-height: 15px; "" mce_style=""font-family: Helvetica, Arial, Geneva; font-size: 13px; line-height: 15px; ""><br></span></div><div><span class=""Apple-style-span"" style=""font-family: Helvetica, Arial, Geneva; font-size: 13px; line-height: 15px; "" mce_style=""font-family: Helvetica, Arial, Geneva; font-size: 13px; line-height: 15px; "">Maybe this post will encourage some people :)</span></div><div><span class=""Apple-style-span"" style=""font-family: Helvetica, Arial, Geneva; font-size: 13px; line-height: 15px; "" mce_style=""font-family: Helvetica, Arial, Geneva; font-size: 13px; line-height: 15px; ""><br></span></div><div><span class=""Apple-style-span"" style=""font-family: Helvetica, Arial, Geneva; font-size: 13px; line-height: 15px; "" mce_style=""font-family: Helvetica, Arial, Geneva; font-size: 13px; line-height: 15px; "">Will</span></div>",,5.0,,0,0
68,20,368,"2010-05-24 15:19:35","<span class=""Apple-style-span"" style=""font-family: Helvetica,Arial,Geneva; font-size: 13px; line-height: 15px;"" mce_style=""font-family: Helvetica, Arial, Geneva; font-size: 13px; line-height: 15px; "">Giovanni,<br><br>Thanks for your feedback. Using the forum to give feedback is a good idea. It allows others to see and comment on suggestions. We might set up a proper feedback forum, but for the moment this topic will have to suffice. <br><br>I also agree that the forum is a bit clunky. However, we have a large list of feature requests and only limited resources for the moment - it might take us some time to address this. Apologies. <br><br>I don't think the prize money in this competition is that relevant (the prize is relatively small). Correct me if I'm wrong but I think contestants are driven by </span><span class=""Apple-style-span"" style=""font-family: Helvetica,Arial,Geneva; font-size: 13px; line-height: 15px;"" mce_style=""font-family: Helvetica, Arial, Geneva; font-size: 13px; line-height: 15px; "">intrinsic</span><span class=""Apple-style-span"" style=""font-family: Helvetica,Arial,Geneva; font-size: 13px; line-height: 15px;"" mce_style=""font-family: Helvetica, Arial, Geneva; font-size: 13px; line-height: 15px; ""> factors.<br><br>A ""karma"" system that rewards forum posts is a good idea. Again, apologies for any delay in implementing this, there are lots of features on our ""to do"" list.<br><br>Anthony<br></span>",,6.0,,0,0
69,20,703,"2010-05-24 15:19:35","Any public collaboration would reduce a team's chance of winning the contest.<br><br>Presumably, a solution requires discovering a set of features with predictive value. Also presumably, these are hard to find, so it's likely that any one team will only find a subset of all predictive features.<br><br>A team will get no benefit from making a feature publicly known, and doing so risks making another team's score better (if the other team was unaware of the feature).<br><br>This is a game theoretic result. The Nash equilibrium is for no team to make features publicly known.<br><br>On the other hand, there is some incentive for teams to collaborate privately. Two teams which are #2 and #3 on the leaderboard could connect in private and agree to share their findings. If they agree to split the prize, then they increase their chances of getting 50% reward, which is better than their individual 0% chance of getting the entire reward.<br><br>(This will be true for any set of teams which do not include first place.)<br><br>Collaboration itself takes time and effort, and it's unclear to me whether $250 is worth the trouble. Most people will probably just lose interest rather than make a concert effort to win.<br><br>If you want people to collaborate, then you should set up the system goals to encourage it. Perhaps a prize for most prolific or best collaboration effort or something.<br><br>Note that there is an incentive for the winning team to tell you all the features they discovered, but no incentive for 2nd or 3rd place or any of the others. If your goal is to discover new features for science, the contest setup is not optimal.<br><br>==========================================================================<br><br>That being said, the flip side is to consider the goals from the point of view of the entrants.<br><br>I imagine that most people have entered the contest with the single goal of winning. There's nothing wrong with this, but note that with 28 entrants on the leaderboard (currently), there is a strong likelihood that any individual team will not win.<br><br>Many of these teams haven't made an entry in the last week, some only made one entry.<br><br>If the only goal is to win the contest, most teams will quickly come to the conclusion that they won't be the winner, or that the payoff is not worth the effort, and such like. I expect many teams will eventually drop out.<br><br>On the other hand, if you have goals which can be met by *entering* the contest, if your goals can be met in the process and not in the destination, then you will most likely see through to the end.<br><br>I'm in the latter category. I had a number of goals which could be met by just entering the contest, plus one goal to win.<br><br>(Why I'm outspoken in the forum.)<br><br>",,7.0,,0,0
72,20,953,"2010-05-24 15:19:35","Guys,&nbsp;<div><br></div><div>While I am a newbie on the site; it feels like the site is extremely slow. Not sure what kind of servers/network you are on, but you should definitely look at improving the response times.&nbsp;</div><div><br></div><div><br></div>",,8.0,,0,0
73,20,368,"2010-05-24 15:19:35","Manish, thanks for the feedback. <br><br>The site is hosted on an Amazon EC2 server on the east coast of America.It's a fast server but the site has been more popular than we expected.<br><br>We're currently working on speeding up the site by reducing the number database queries. We may have to implement auto scaling if the site keeps growing so rapidly. <br><br>Anthony<br><br mce_bogus=""1"">",,9.0,,0,0
74,20,368,"2010-05-24 15:19:35","Just made a change which should speed things up. Let me know if it has made a difference for you.<br mce_bogus=""1"">",,10.0,,0,0
77,20,882,"2010-05-24 15:19:35","&gt; The site is hosted on an Amazon EC2 server on the east coast of 
America.It's a fast server but the site has been more popular than we 
expected.<br><br>As problems go that's a good one to have.&nbsp; Congratulations.<br><br>&gt; We're currently working on speeding up the site by reducing the number 
database queries. We may have to implement auto scaling if the site 
keeps growing so rapidly.<br><br>Most of the pages on the site are fairly static so caching those database queries should make a massive difference.&nbsp; The forum is the most dynamic location and even there you're getting 10 to 100 reads for every write.<br><br>Would it not be quite difficult to dynamically scale the database?&nbsp; You would need to start the new database, copy across the complete database from the master to the slave and then re-route the database queries.&nbsp; Given the fickle nature of visitors from social media sites (where I guess most of your spikes in traffic originate from) auto-scaling could be useful for the apache servers once as many of the database reads as possible are cached.<br><br>Speaking of apache, a common approach to squeezing a bit more performance out of a web server is to stick nginx in front of apache to serve the static content and act as a reverse proxy.&nbsp; Have you considered this?&nbsp; You could also try serving your static resources with s3 or cloudfront.&nbsp; The bandwidth charges appear to be the same as ec2 (although the asian cloudfront edge locations are more expensive) and it would relieve the pressure on your servers.&nbsp; Particularly with social media spikes when your visitors will have unprimed caches.<br>",,11.0,,0,0
78,20,368,"2010-05-24 15:19:35","<div><span class=""Apple-style-span"" style=""font-family: Helvetica, Arial, Geneva; font-size: 13px; line-height: 15px; "">Jonathan, thanks for your feedback (x2). We're currently working on caching database queries. There are a lot of good suggestions here that we'll try before autoscaling.&nbsp;</span></div>",,12.0,,0,0
79,20,882,"2010-05-24 15:19:35","No worries.&nbsp; Semi-intelligent sounding suggestions are easy.&nbsp; It's actually implementing them which is the hard bit.&nbsp; Good luck!<br mce_bogus=""1"">",,13.0,,0,0
56,21,650,"2010-05-24 15:21:18","ok, I am a good person, so I am going to post this here... hoping that somebody will respond with a similar level of feedback and maybe collaborate with me to solve this competition. <br><br>A nice hint to help solving the competition is this table/database:<br>- http://hivdb.stanford.edu/cgi-bin/PositionPhenoSummary.cgi<br><br>It shows the list of all the positions that are known to be associated with resistance to an HIV treatment, one of AZT, D4T, TDF, ABC, DDI, DDC, 3TC. You see that not all the positions in the sequences are equally important, and it is not always true that the positions that vary the most are more correlated with resistance. It is probable that these positions correspond to key aminoacids in the sequence, that have a key structural role or participate to the catalytic site of the protein.<br><br>My original approach was to use this table to write a machine-learning based software using these inputs, since using all the positions in the sequences would be too cpu-consuming.<br><br>As I was saying in a previous post, I am not interested in winning the prize of this competition, but I would like to learn from people expert in machine-learning methods... I think I could find other applications for these methods to other biological problems, if I learn how to use them properly. So please, don't be shy with the feedback now :-)<br mce_bogus=""1"">",,1.0,,0,0
60,21,703,"2010-05-24 15:21:18","This is an excellent resource, thank you.<br><br>I am wondering, though, is this within the scope of the competition? Are we allowed to use it?<br><br>To win the competition, a prediction method would have to justify the weight given to each component of the decision process. Are we allowed to say ""this piece is weighted highly because of that external data""?<br><br>Cory's proteomics data appears to be information calculated from the given sequences - molecular weight, for instance. That's probably OK for the contest.<br><br>Fontanelles disqualified themselves by having specialized information.<br>
<br>
<br>Will - could you post a reply clarifying the issue?<br><br mce_bogus=""1"">",,2.0,,0,0
61,21,478,"2010-05-24 15:21:18","I'm perfectly happy with using outside information like known HIV-1 resistance mutations, functional annotations or anything else you can think of.<br>",,3.0,,0,0
